Название,User ID,Тип объекта
Менеджер проектов,15320,Вакансия
Validation Manager,15320,Вакансия
Intern for Compliance Department,15320,Вакансия
Services Account Manager Intern (Consulting Sales),15320,Вакансия
Working Student Services Marketing MEE Job,15320,Вакансия
Консультант,15320,Вакансия
Старший специалист,15320,Вакансия
Quantitative Analyst,15320,Вакансия
Специалист по управлению категориями (food),15320,Вакансия
Project Manager образовательных продуктов,15320,Вакансия
Специалист по продажам (инвестиционные продукты),15320,Вакансия
Unilever Leadership Internship Programme,15320,Вакансия
Стажер в группу по работе с молодыми специалистами в Департамент по работе с персоналом,15320,Вакансия
Brand Manager,15320,Вакансия
HR-менеджер,15320,Вакансия
Менеджер по развитию продукта валютный контроль для малого бизнеса,15320,Вакансия
Менеджер проектов в команду качества,15320,Вакансия
Аналитик,21030,Вакансия
Решайте кейсы как CEO: классический подход консультантов,933,Статья
Введение в кейс-метод: что такое кейсы и зачем они нужны,933,Статья
Зрить в корень: как найти решение кейса с помощью Issue Tree,933,Статья
Стажер направления по развитию цифровых технологий,30596,Вакансия
Стажер в отделе исследования рынка потребителей,30596,Вакансия
"Регистрируйся в личном кабинете, чтобы бесплатно прочитать электронную версию",6204,Чемпионат
Интерн-аналитик в нефтегазовом секторе,36308,Вакансия
Открыта регистрация на Supply Chain Cup 2020 от Changellenge >>,35646,Чемпионат
Project Manager образовательных продуктов,1743,Вакансия
Research аналитик,1743,Вакансия
Аналитик,1743,Вакансия
Product Owner образовательных продуктов,1743,Вакансия
Разработчик IT-кейсов,1743,Вакансия
Selection аналитик,1743,Вакансия
Программа развития бизнес-лидеров UNIQLO Manager Candidate,33926,Вакансия
Стажер в IT,33926,Вакансия
С места в карьеру: как пройти отбор в крупные компании,2942,Статья
С завода в «Большую четверку»,2942,Статья
"Семь лучших книг, которые научат управлять своими эмоциями",2942,Статья
"10 приложений, которые помогут сконцентрироваться на работе",2942,Статья
Тест. Насколько у вас прокачан эмоциональный интеллект?,2942,Статья
Чисто гипотетически: как проверить свои предположения на кейс-интервью,2942,Статья
Зрить в корень: как найти решение кейса с помощью Issue Tree,2942,Статья
Какая информация нужна для решения кейса и где ее найти,2942,Статья
Кто такие зумеры и во что они превратят рынок труда,2942,Статья
Image recognition key user,33926,Вакансия
"Набор в магистратуру от МФТИ, бизнес-школы СКОЛКОВО и МТС",2942,Мероприятие
KPMG Quiz for students,2942,Мероприятие
"Вебинар от EY ""Audit for beginners""",2942,Мероприятие
PwC Лаборатория аудита,2942,Мероприятие
Стажер в отдел персонала онлайн проектов,33462,Вакансия
Начинающий специалист / Стажер группы управления строительными проектами,33462,Вакансия
Карьера в аналитике и big data,2942,Статья
Research аналитик,32599,Вакансия
Аналитик,32599,Вакансия
Стажер в IT,32569,Вакансия
Стажер в группу технической поддержки клиентов,32569,Вакансия
Консультант начального уровня департамента управления рисками,5467,Вакансия
Стажер департамента управления рисками,5467,Вакансия
Аналитик в группу проектного финансирования и инфраструктуры,5467,Вакансия
Специалист группы повышения эффективности бизнеса,5467,Вакансия
Финансовый аналитик в отдел поддержки маркетинга,5467,Вакансия
Финансовый аналитик по выручке,5467,Вакансия
Бизнес-аналитик в департамент управления рисками,5467,Вакансия
Стажер в группу финансового риск-менеджмента,5467,Вакансия
Первый онлайн-курс для будущих инженеров от Норникеля. Регистрация до 2 августа,2306,Мероприятие
Консультант начального уровня в департамент управления рисками,31379,Вакансия
Intern in IT audit / IT advisory group,30831,Вакансия
"Магистратура «Цифровые технологии в бизнесе» от МФТИ, бизнес-школы СКОЛКОВО и МТС",445,Другое
Подача заявок на совместную магистратуру от МФТИ и бизнес-школы СКОЛКОВО,445,Мероприятие
Аналитик,30689,Вакансия
Аналитик по стратегии,30689,Вакансия
Intern in Market Research,30507,Вакансия
Ассистент аудитора,30507,Вакансия
Специалист группы повышения эффективности бизнеса,2343,Вакансия
Мы запустили новый онлайн-курс по подготовке к GMAT!,29964,Другое
Хотите первым прочитать учебник Changellenge >> по решению кейсов?,29964,Другое
Стажер в E-commerce,27382,Вакансия
Стажер по коммуникациям,27382,Вакансия
Стажер по коммуникациям,29387,Вакансия
"Регистрируйся в личном кабинете, чтобы бесплатно прочитать электронную версию",29138,Чемпионат
Чисто гипотетически: как проверить свои предположения на кейс-интервью,29038,Статья
Зрить в корень: как найти решение кейса с помощью Issue Tree,29038,Статья
Какая информация нужна для решения кейса и где ее найти,29038,Статья
Что такое кейс-интервью и зачем оно нужно,29038,Статья
Стажер в отдел персонала онлайн проектов,27382,Вакансия
Консультант по информационной безопасности,27382,Вакансия
Бизнес-аналитик в департамент управления рисками,27382,Вакансия
Специалист по инвестиционному анализу,27382,Вакансия
Стажер в управлении цепями поставок,27382,Вакансия
Стажер в отдел продаж,27382,Вакансия
Менеджер по развитию продукта Валютный контроль для малого бизнеса,28645,Вакансия
Специалист по планированию и контролю реализации проекта,27793,Вакансия
Стажер в финансовую дирекцию,27320,Вакансия
Стажер в дирекции по маркетингу (бренд М.Видео),27320,Вакансия
Стажер в управлении цепями поставок,27320,Вакансия
Открыта регистрация на оплачиваемую стражировку Nestlé,1823,Мероприятие
Открыта регистрация на оплачиваемую стажировку в BCS Global Markets,1823,Мероприятие
Научитесь быстро обрабатывать большие массивы данных. Регистрируйтесь на бесплатный вебинар 23 июня в 20:00,1823,Мероприятие
Открыта регистрация на Летнюю академию аудита в Санкт-Петербурге от PwC,1823,Мероприятие
Две вакансии в Москве,26769,Вакансия
Стажер направления по развитию цифровых технологий,26769,Вакансия
2 оплачиваемые стажировки: Бизнес-аналитика и E-commerce,26769,Вакансия
Консультант,26731,Вакансия
Консультант по интеграции,26731,Вакансия
Консультант поддержки портальных решений,26731,Вакансия
SAP Consulting Intern,26731,Вакансия
Консультант,26731,Вакансия
Разработчик IT-кейсов,26731,Вакансия
Стажер в отдел рекрутмента,26558,Вакансия
2 ВАКАНСИИ В МОСКВЕ,26558,Вакансия
Unilever Leadership Internship Programme,26558,Вакансия
"Стажировка в Mars для студентов, 9 направлений",26558,Вакансия
Talent Acquisition Specialist,26558,Вакансия
Стажер в отдел маркетинга,26558,Вакансия
Corporate Communications Intern,26558,Вакансия
Стажер (Logistic),26558,Вакансия
Стажер-аналитик,26558,Вакансия
Trade Marketing Intern,26558,Вакансия
Стажер Future Leaders Program,26558,Вакансия
Специалист по продажам и развитию территории,26558,Вакансия
Marketing Intern,26558,Вакансия
Стажер в управлении цепями поставок,26558,Вакансия
Junior Investment Advisor,26659,Вакансия
"Стажер, Группа по сопровождению корпоративных сделок (Финансовый сектор)",9243,Вакансия
Разработка стратегии повышения качества сервиса и увеличения объема продаж в магазинах ОБИ,1553,Кейс
Открыта регистрация на Карьерную онлайн-конференцию Total Mоdern Trade от Changellenge >>,1553,Чемпионат
Открыта регистрация на стажировку Mars Internship Experience Program в продажах,1553,Мероприятие
Карьерный вебинар от эксперта Школы Changellenge >>,1553,Мероприятие
Запуск нового препарата,3,Кейс
Ответственность за здоровье прививается с детства,3,Кейс
UNILEVER «ПЕРЕСМОТР ЦЕЛЕВОЙ АУДИТОРИИ И ПРИВЛЕЧЕНИЕ НОВЫХ СЕГМЕНТОВ»,1823,Кейс
Ответственность за здоровье прививается с детства,80,Кейс
Go Uber: Поиск новых эффективных каналов привлечения водителей,3,Кейс
Последние дни регистрации на первый День Карьеры Changellenge >> в онлайн-формате,3,Чемпионат
Оптимизация процессов 5,3,Кейс
Оптимизация процессов 6,2,Кейс
Аналитик в группу поддержки и аналитики прямых и корпоративных продаж,1226,Вакансия
Консультант - Направление РСБУ,21030,Вакансия
2 ВАКАНСИИ В МОСКВЕ,21030,Вакансия
Специалист по работе с клиентами,21030,Вакансия
Стажер в группу повышения эффективности бизнеса (Strategy&Transformation),21030,Вакансия
Стажер консалтинга в сфере информационных технологий,21030,Вакансия
Менеджер по развитию продукта валютный контроль для малого бизнеса,21030,Вакансия
Стажер,21030,Вакансия
Стажер,21030,Вакансия
4 вакансий в отделе Project Management,21030,Вакансия
Ускоренная программа стажировок от МТС,21030,Вакансия
Менеджер проектов,21030,Вакансия
Стажер в группу оказания услуг в области бизнес рисков,21030,Вакансия
Ассистент отдела маркетинга,21030,Вакансия
Стажер (Logistic),21030,Вакансия
Оптимизация процессов 6,3,Кейс
Оптимизация процессов 2,3,Кейс
Оптимизация процессов 2,2,Кейс
Talent Coordinator,9098,Вакансия
Мы запустили новый онлайн-курс по подготовке к GMAT!,3942,Другое
Открыта регистрация на стажировку Tele2 Новые герои,21591,Мероприятие
Открыта регистрация на карьерный вебинар от Школы Changellenge >>,18679,Мероприятие
Открыт прием заявок на оплачиваемую стажировку Sberseasons,20471,Мероприятие
Storylining в PowerPoint: создаем историю презентации,933,Статья
Удобные таск-менеджеры для удаленной работы,933,Статья
Регистрируйся на бесплатный вебинар в рамках онлайн-курсов Changellenge >> ToolKit,15726,Мероприятие
Десять образовательных платформ для онлайн-обучения,18679,Статья
Регистрируйся на бесплатный вебинар в рамках онлайн-курсов Changellenge >> ToolKit,1490,Мероприятие
Открыт прием заявок на День Карьеры Changellenge >> Cup Russia в онлайн-формате,15726,Мероприятие
Project Manager,516,Вакансия
4 вакансий в отделе Project Management,516,Вакансия
Стажер по проектам развития бизнеса,516,Вакансия
Открыт набор заявок на оплачиваемую стажировку HeadStart,18679,Мероприятие
"Регистрируйся в личном кабинете, чтобы бесплатно прочитать электронную версию",18100,Чемпионат
Searching как искусство: где и как правильно искать информацию,4205,Статья
Регистрируйся на самый масштабный день карьеры в онлайн-формате!,2683,Другое
Начни работу в корпоративном и инвестиционном банкинге,2683,Другое
Закрывается прием заявок на курс «Разгляди себя в нефтегазе» от компании «Шлюмберже»,17715,Мероприятие
Стажер (Logistic),17388,Вакансия
Финансовый аналитик по логистическим затратам,17388,Вакансия
Стажер в отдел закупок,17388,Вакансия
Закрывается прием заявок на курс «Разгляди себя в нефтегазе» от компании «Шлюмберже»,16978,Мероприятие
"Чтобы заниматься стратегией профессионально, нужно принимать правильные решения для сложных задач",4205,Статья
Мастер-джедай: кто такой ментор и зачем он нужен,4205,Статья
Зачем консультанту Data Science,4906,Статья
Проджект менеджер,2683,Мероприятие
Последние дни регистрации на первый День Карьеры Cup IT/Tech в онлайн-формате,2683,Мероприятие
Открыта регистрация на обучение на онлайн-курсах Changellenge >> ToolKit за 990 р,15837,Мероприятие
Закрывается прием заявок на вебинар по разбору кейса от Bain & Company,15837,Мероприятие
"Intern, Transaction Services, Financial Services Sector",2942,Вакансия
"Intern, Corporate Risk Management",2942,Вакансия
"Младший консультант, Группа по оценке финансового сектора",2942,Вакансия
"Intern, Deal Strategy Group",2942,Вакансия
"Intern, Financial Risk Management Group (Modelling)",2942,Вакансия
"Intern (Financial Advisory Services, Management Consulting)",2942,Вакансия
Стажер/Младший консультант (практика по работе с клиентами энергетики и ЖКХ),2942,Вакансия
"Intern (Strategy and Operations, Management Consulting)",2942,Вакансия
Один дома: как работать на удаленке,4205,Статья
"Семь лучших книг, которые научат управлять своими эмоциями",4205,Статья
Как уйти в отпуск,2942,Статья
Почему вам нужен ментор,2942,Статья
Какие интересные и полезные книги почитать в праздники,2942,Статья
Один дома: как работать на удаленке,2942,Статья
Как провести каникулы с пользой для карьеры: 7 советов от экспертов Санофи и генерального директора Changellenge >>,2942,Статья
Вы должны постоянно быть на виду,2942,Статья
Как строить карьеру в компании: от трудоустройства до первого повышения.,2942,Статья
6 правил продуктивного конфликта,2942,Статья
Избавиться от «мертвых душ» в команде,2942,Статья
Как составить сопроводительное письмо: 11 полезных советов,2942,Статья
Что такое Problem Solving Test и как к нему подготовиться?,2942,Статья
VCV: что такое видеоинтервью и как к нему подготовиться,2942,Статья
Как продуктивно проводить выходные: 10 главных правил,2942,Статья
"5 TED-выступлений, которые необходимо посмотреть перед следующим собеседованием",2942,Статья
Финансы для неофитов: как перестать бояться и полюбить денежные потоки,2942,Статья
"Слайды, драконы и тайм-менеджмент: CFA Level I за 60 часов",2942,Статья
13 способов победить выгорание,2942,Статья
Что такое фит-интервью и как его пройти,2942,Статья
Как пройти PST-тестирование и его аналоги во время отбора,2942,Статья
GMAT: что почитать и посмотреть для подготовки,2942,Статья
Как впечатлить робота-рекрутера и построить карьеру в эпоху уберизации,2942,Статья
Путевка в консалтинг: секреты успешного кейс-интервью,2942,Статья
Как одеться на собеседование,2942,Статья
5 полезных функций Excel для финмоделирования,2942,Статья
Как визуализировать данные в Excel. Часть 1,2942,Статья
Как визуализировать данные в Excel. Часть 2,2942,Статья
"Как строить планы, которые сбудутся",2942,Статья
"Карьера в FMCG: Лидерство, SNICKERS и переговоры с Китаем",2942,Статья
Карьерные провалы выдающихся предпринимателей,2942,Статья
Как решать нестандартные задачи и строить диаграмму «Водопад» в Exсel,2942,Статья
Консалтинг или бизнес: что выбрать?,2942,Статья
Как построить личный бренд,2942,Статья
Как выжить в разных корпоративных культурах,2942,Статья
Почему ваши планы не сбудутся,2942,Статья
"8 техник переговоров, которые помогут добиться своего",2942,Статья
"В будущем пропадет приватность: интервью Леонида Ткаченко, директора департамента Big Data МТС",2942,Статья
Живи как СЕО: режим дня известных бизнесменов,2942,Статья
Пять главных источников стресса на работе,2942,Статья
Как новичку стать неформальным лидером,2942,Статья
Живи как CEO,2942,Статья
Как за месяц освоить Excel — самый востребованный инструмент для работы с данными,2942,Статья
Как все успеть: 6 методик тайм-менеджмента,2942,Статья
Как не переинвестировать в себя,2942,Статья
Как не сгореть на работе,2942,Статья
Кто зарабатывает по 3 миллиона в месяц,2942,Статья
"Лучше, чем маховик времени",2942,Статья
"5 челленджей, справиться с которыми поможет Excel",2942,Статья
Как стать топом: изучайте советы CFO Московской Биржи и выиграйте приглашение на деловой завтрак!,2942,Статья
Без манипуляций: как убеждать с помощью фактов,2942,Статья
Какой из ваших постов станет причиной отказа в работе,2942,Статья
Как получить максимальный балл за TalentQ test,2942,Статья
Как завалить отбор в Big3,2942,Статья
Заповеди деловой переписки,2942,Статья
Как жить и не тратить лишнего,2942,Статья
Четыре шага для адаптации на новой работе,2942,Статья
Как решать кейсы,2942,Статья
Отказы на собеседовании: как реагировать и какую пользу извлечь,2942,Статья
Ищем оптимальное решение задачи с неизвестными параметрами в Excel,2942,Статья
Скрытая угроза: как страхи мешают строить карьеру,2942,Статья
Подписать договор и не облажаться,2942,Статья
Уйти из McKinsey & Company и заняться попкорном: интервью с основательницей Holy Corn,2942,Статья
Наводим порядок на столе по методу Мари Кондо,2942,Статья
Не откладывать на потом: 5 способов борьбы с прокрастинацией,2942,Статья
Как найти работу мечты — инструкция по применению,2942,Статья
"Лень, эгоизм и A/B-тесты: как создавать цифровые продукты",2942,Статья
Как победить в McKinsey Business Diving,2942,Статья
