Название,User ID,Тип объекта
Changellenge >> Cup Moscow 2021,95316,
Changellenge >> Cup Moscow 2021,16101,
Changellenge >> Cup Moscow 2021,94714,
Changellenge >> Cup Moscow 2021,98411,
Changellenge >> Cup Moscow 2021,86117,
Changellenge >> Cup Moscow 2021,97238,
Cup Construction 2021 от Changellenge >>,97238,
Cup Construction 2021 от Changellenge >>,97560,
Cup Construction 2021 от Changellenge >>,97224,
Cup Construction 2021 от Changellenge >>,95808,
Вебинар о навыках аналитика данных,2683,
Продолжение регистрации на Hack&Change 2021,3,
Стажер-аналитик в KION,85033,
Бизнес-аналитик практикант,85033,
Младший экономист/стажер,85033,
Стажер в департамент продаж,85033,
Стажер направления разработка отчетности,84908,
Sberseasons,84908,
Аналитик (Adhesive Technologies),84908,
Procter & Gamble,2,
Младший менеджер по работе с ключевыми клиентами / Junior KAM (Beauty Care),64922,
JKAM/ Junior Key Account Manager/ Key Account Executive,64922,
Карьерная конференция Total Modern Trade: Pandemic Edition,79208,
Стажер/Младший консультант группы налогового консультирования финансового сектора,72184,
Летняя стажировка в MSD,72184,
Finance Automation Intern,72184,
Стажер в сфере бизнес-аналитики в Департамент управления рисками,72184,
Стажировка в планировании поставок и спроса,72184,
Стажировка в исследовании рынка,72184,
Стажировка в отделе продаж,72184,
Стажировка в отделе исследования рынка и потребителей,72184,
Marketing Controlling Intern (Finance Department),72184,
Стажер в департамент аудита корпоративного сектора,72184,
Бизнес аналитик,78503,
Стажировка в Rambler Group,77296,
Стажер-аналитик,77296,
Sberseasons,77296,
Стажер отдела финансового планирования и анализа,77296,
Стажер по аналитике больших данных в МегаФоне,77296,
Дистанционный аналитик,72760,
Специалист по управлению категориями (food),72760,
"Consultant, Internal Audit, Risk and Compliance Services Group",72760,
"Стажировка в Mars для студентов, 9 направлений",72760,
Стажер в отдел маркетинга,72760,
Trade Marketing Intern,72760,
Marketing Intern,72760,
Аналитик,72760,
Стажер в E-commerce,72760,
Стажер в Digital Marketing,72760,
Стажер в отделе исследования рынка потребителей,72760,
Аналитик BI (MIS),72760,
Mars Internship Experience Program (отдел маркетинга),72760,
Интерн-аналитик в секторе розничной торговли,72760,
Визуализатор,72760,
Ассистент отдела маркетинга,72760,
Стажер в отдел обучения и развития персонала,72760,
"Интерн/Аналитик направления ""Applied Intelligence""",72760,
Стажер в группу услуг в области чистых технологий и устойчивого развития,72760,
Consultant/Intern in Human Resourcing consulting group,72760,
Интерн/Аналитик в практику рынки капитала (технологический консалтинг),72760,
Стажер в направление Digital маркетинг,72760,
Стажер-аналитик,72760,
Младший аналитик отдела продаж,72760,
Mars Leadership Experience Program,72760,
Intern in Market Research,72760,
Intern/Analyst Accenture Strategy (Assessment Centre),72760,
"Интерн/Аналитик (Retail, FMCG, Pharma, Automotive)",72760,
Стажировка в отделе аналитики продаж,72760,
Стажер в группу анализа данных и моделирования,72760,
Стажер отдела маркетинга стран Украина и СНГ,72760,
Стажер отдела маркетинга,72760,
"Стажер отдела этики, рисков и соблюдения политик и процедур (compliance)",72760,
Летняя стажировка в MSD,72760,
Data Analyst,72760,
Стажировка в исследовании рынка,72760,
Стажер в отдел Data Analytics,72760,
Стажировка в отделе исследования рынка и потребителей,72760,
"Фриланс by Changellenge >>: работа для тех, кто не готов выходить на full-time",76622,
Гарантированные призы для твоего развития от Changellenge >> и издательства МИФ,76622,
Стажер в сфере IT-бизнес-аналитики в Департамент управления рисками,76520,
IT Internship,76520,
Стажер/Младший консультант группы управления финансами и казначейством (Consulting),76302,
Стажер в Департамент управления рисками,76302,
Accelerated Career Programme (летняя стажировка в управленческом консалтинге),76302,
Стажер/Специалист в группу трансформации бизнеса (Business Transformation Oil&Gas Projects),76302,
Практика в закупках и финансах,76302,
Intern in Fraud Investigations Group (Forensic Department),76302,
"Если вас не повышают, то вы уходите",2942,Статья
Координатор отдела бизнес операций (Beauty Care),26731,
Начинающий специалист аудита,64922,
"Работа в нефтегазе только для мужчин? Конечно, нет! Развей этот стереотип на курсе для девушек от «Шлюмберже». Разгляди себя в нефтегазе >>",65443,Другое
Самый масштабный День карьеры Changellenge >> Cup Russia,70787,
Всероссийский кейс-чемпионат Audit Cup 2021,8695,
Стажер в направление Digital маркетинг,70390,
Mars Leadership Experience Program,70390,
Младший аналитик отдела продаж,70390,
ЛУКОЙЛ Оверсиз,64286,
Татнефть,64286,
Schlumberger,64286,
Schneider Electric,64286,
Aggreko,64286,
Accelerated Career Programme (летняя стажировка в управленческом консалтинге),50972,
Marketing Trainee (Laundry & Home Care),50972,
Стажер в направление Digital маркетинг,50972,
Шеф редактор,50972,
Sustainability Communications Internship,50972,
Consultant/Intern in Human Resourcing consulting group,50972,
Senior HR Manager,50972,
Consultant/Intern in Human Resourcing consulting group,50972,
Associate Consultant,50972,
Начинающий разработчик в группу по оказанию услуг в секторе недвижимости и строительства,2,
Junior Design Leader,2,
PowerPoint Challenge: сделать эффектную презентацию и не потратить вечность,70509,
Младший специалист исследовательского центра в Департамент внутренней поддержки,66569,
Сибур,3253,
Procter & Gamble,3253,
Bain and Company,3253,
Стажер в департамент аудиторских услуг,64922,
Стажер в группу стратегии управления капиталом и исследований рынков,64922,
Интерн/консультант в Audit FS,64922,
Младший юрист в группу по оказанию юридических услуг,65767,
Стажер в отдел обучения и развития персонала,64922,
Стажер в Академию бизнеса EY (административная поддержка),64922,
Стажер/Младший аналитик в группу оценки бизнеса,64922,
"Стажер/Специалист в отдел оказания консультационных услуг в сфере недвижимости, инфраструктуры",64922,
Стажер в группу операционных рисков и устойчивого развития,64922,
Стажер в группу услуг в области чистых технологий и устойчивого развития,64922,
Стажер в группу трансформации бизнеса,64922,
Стажер/Специалист в группу по сопровождению сделок (Финансовый сектор),64922,
Специалист в группу обработки и анализа клиентских данных (CDHA),64922,
Стажер в группу по оказанию услуг таможенного регулирования и международной торговли,64922,
Стажер в группу повышения эффективности бизнеса в области финансов,64922,
Стажер в группу оказания услуг в области бизнес-рисков,64922,
Danone Dive Finance,57894,
Старший специалист группы анализа внутренней достаточности капитала,57894,
Стажер в группу трансформации бизнеса,57894,
IT Product Management Internship,57894,
Associate Consultant Intern,57894,
Project Manager образовательных продуктов,57894,
Разработка стратегии развития и лидерства крупнейшего частного банка страны,59008,Кейс
Инженер-проектировщик по программе «Молодой специалист»,62284,
Sustainability Communications Internship,61164,
Инженер-проектировщик по программе «Молодой специалист»,60752,
Стажер в Digital Marketing,60122,
Начинающий специалист / Стажер группы управления строительными проектами,57673,
Стажерская программа: Академия Стальных Возможностей. IT направления,56591,
Стажер в отдел маркетинга Сбермаркет,57673,
Стажер-аналитик,58099,
Стажер в отдел управления торговым пространством (Коммерческая служба),37657,
Стажер / специалист в группу оказания услуг организациям финансового сектора,16995,
Бесплатный мастер-класс от создательницы курса «Бизнес-презентации в PowerPoint»,57794,
Стажировка в команде SAP,57794,
Бесплатный мастер-класс «Как стать бизнес-аналитиком и пройти отбор в компанию мечты»,57769,
Marketing Intern,31465,
Mars Internship Experience Program (отдел маркетинга),31465,
Аналитик,57673,
Инженер-проектировщик по программе «Молодой специалист»,45995,
Как стать частью сильной FMCG-команды,2942,Статья
От студента до руководителя: пять основных видов найма,2942,Статья
Карьера в финансах,2942,Статья
Начинающий специалист / Стажер группы управления строительными проектами,56805,
Карьера в консалтинге,2626,Статья
Примите участие в совместном IT-проекте МФТИ и «Роскосмоса»,2683,
Бесплатный мастер-класс «Как стать бизнес-аналитиком и пройти отбор в компанию мечты»,2683,
Начни год правильно на Школе Changellenge >>,2683,
"Составьте резюме, которое принесет оффер на бесплатном вебинаре Школы Changellenge >>",2942,Компания
Онлайн-курс «Подготовка к GMAT»,2942,Курс
Бесплатный вебинар по решению бизнес-задач от Школы Changellenge >>,2942,Другое
Не бойся пробовать и получи крутую позицию на Дне Карьеры Changellenge >> Cup Moscow!,2942,Другое
Карьера в HR и рекрутменте,53935,Статья
Регистрируйся на кейс-чемпионат по решению стратегических бизнес-задач от P&G!,53935,Чемпионат
Не бойся пробовать и получи крутую позицию на Дне Карьеры Changellenge >> Cup Moscow!,53935,Чемпионат
Не бойся пробовать и получи крутую позицию на Дне Карьеры Changellenge >> Cup Moscow!,53935,Другое
Яндекс,3,
"Зарегистрируйся, чтобы узнать как прокачивать IT-компетенции и оставаться конкурентоспособными!",3,
Младший специалист в группу управления делами,3,
Акция Changellenge >> и ЛитРес: скидка 30% на все курсы Toolkit и промокоды на бизнес-литературу,3,
KPMG S&O Online Case Championship,3,
Лидерская программа Unilever Future Leaders Programme (направление HR),52805,Вакансия
Ресечер в группу подбора персонала,52805,Вакансия
Стажер в группу кадрового делопроизводства,52917,Вакансия
Стажер/специалист в департамент налогового консультирования,52917,Вакансия
Ресечер в группу подбора персонала,52917,Вакансия
Стажировка Sberseasons,52917,Вакансия
Стажировки в отделе продаж,27382,Вакансия
Хочешь узнать больше о функционале Excel? Регистрируйся на бесплатный вебинар до 24 ноября!,45100,
Стажировки в IT,6204,Вакансия
IT-department trainee,6204,Вакансия
KPMG Excel Tricks,2942,Мероприятие
Хочешь узнать больше о функционале Excel? Регистрируйся на бесплатный вебинар до 24 ноября!,2942,Мероприятие
PwC Financial Sector Intensive,2942,Мероприятие
PwC Insight from Inside,2942,Мероприятие
Стажер в PRGM,5453,Вакансия
Project Manager образовательных продуктов,47052,Вакансия
Решайся уже: как презентовать выводы на кейс-интервью,2942,Статья
Тест. Пройдете ли вы кейс-интервью?,2942,Статья
Карьера в менеджменте,2942,Статья
Шпаргалка по Excel для начинающих финансистов,2942,Статья
Как найти подход к любому человеку,2942,Статья
"Восемь советов, которые помогут привыкнуть к работе в офисе",2942,Статья
Storylining в PowerPoint: создаем историю презентации,2942,Статья
Три лайфхака по решению задач GMAT,2942,Статья
Регистрируйся на бесплатный вебинар по структурному мышлению до 19 ноября,2942,Мероприятие
Как правильно уходить в отпуск и возвращаться из него,2942,Статья
Как студенты влияют на будущее голосовых помощников,2942,Статья
Карьера в предпринимательстве,2942,Статья
Все о работе в Mail.ru Group,2942,Статья
Как победить в RB Global Challenge и начать международную карьеру,2942,Статья
Changellenge >> Cup Moscow 2020,50241,Чемпионат
Changellenge >> Cup Moscow 2020,34379,Чемпионат
Продолжение регистрации на онлайн-хакатон hack&Change от Changellenge >>,45100,
Школа аудита EY,3,Мероприятие
Координатор по работе с ключевыми клиентами,3,Вакансия
Как студенты влияют на будущее голосовых помощников,3,Статья
Финал Ingosight,45432,
Последние дни регистрации на Cup Moscow 2020!,2942,Мероприятие
Крупнейшая ежегодная онлайн-конференция Unilever!,2942,Мероприятие
"""Хотите узнать как оценить эффективность бизнеса по финансовой отчётности?"" Бесплатный вебинар",2942,Мероприятие
"Программа найма в СИБУР ""Первый элемент"" для химиков",48573,Статья
Тест. Пройдете ли вы кейс-интервью?,46073,Статья
Решайся уже: как презентовать выводы на кейс-интервью,46073,Статья
"Как найти работу, на которую захочется ходить",46073,Статья
Стоит ли ехать учиться за границу,46073,Статья
Как правильно уходить в отпуск и возвращаться из него,46073,Статья
Как студенты влияют на будущее голосовых помощников,46073,Статья
Все о работе в Mail.ru Group,46073,Статья
Участник программы развития Future Makers,48279,Вакансия
Стажер-аналитик,45719,Вакансия
Аналитик,45719,Вакансия
Стажер в отдел практики стратегического консультирования EY-Parthenon,45719,Вакансия
Специалист исследовательского центра,45719,Вакансия
Стажер в отделе исследования рынка потребителей,45719,Вакансия
Координатор в отдел корпоративной стратегии,45719,Вакансия
Консультант в группу CIPS стратегического и операционного консалтинга,45719,Вакансия
Интерн-аналитик в департаменте стратегического консалтинга,45719,Вакансия
Management Trainee,45719,Вакансия
Координатор по подбору персонала,45369,Вакансия
Стажер в отдел персонала онлайн проектов,45369,Вакансия
Стажер в группу управления персоналом,45369,Вакансия
Лидерская программа (технические направления),44354,Вакансия
Junior Investment Advisor,34470,Вакансия
Специалист группы повышения эффективности бизнеса,33462,Вакансия
Стажер отдела финансового контроллинга,33462,Вакансия
Стажер в финансах,33462,Вакансия
"Стажер в группу актуарных расчетов, аудит",33462,Вакансия
Инженер-разработчик PL/SQL,33462,Вакансия
Лидерская программа Unilever Future Leaders Programme (направление Customer Development),33462,Вакансия
Лидерская программа Unilever Future Leaders Programme (направление Supply Chain),33462,Вакансия
Стажер в отделе исследования рынка потребителей,33462,Вакансия
Начинающий специалист аудита в банковском секторе,33462,Вакансия
Mars Internship Experience Program (отдел маркетинга),33462,Вакансия
Координатор отдела аналитики и отчетности,33462,Вакансия
Интерн-аналитик в секторе розничной торговли,33462,Вакансия
Интерн-аналитик в практику технологического консалтинга,33462,Вакансия
Стажер в группу по оказанию услуг в области внутреннего аудита и рисков,33462,Вакансия
Стажер в группу повышения эффективности бизнеса в области розничной торговли и электронной коммерции,33462,Вакансия
Стажер в департамент аудиторских услуг,33462,Вакансия
Интерн-аналитик в нефтегазовом секторе,41434,Вакансия
Последняя неделя регистрации на Supply Chain Cup 2020 от Changellenge >>,2,Чемпионат
Подайте заявку и получите шанс попасть на стажировку в топовую компанию.,3,
Продолжается набор на 15 направлений стажировки Sberseasons в 5 городах России.,3,
"Регистрируйся в личном кабинете, чтобы бесплатно прочитать электронную версию",41297,Чемпионат
"Креативная задача, погружение в страхование и шанс проявить себя — все это ждет тебя на INGOSight 2020",41297,Чемпионат
Junior HR-manager,40214,Вакансия
Research аналитик,40214,Вакансия
Копирайтер,40214,Вакансия
Младший кредитный аналитик,40214,Вакансия
Стажер в группу консультирования по управлению персоналом,40214,Вакансия
Начинающий разработчик в группу по оказанию услуг в секторе недвижимости и строительства,40214,Вакансия
Стажер в группу оказания услуг организациям финансового сектора,40214,Вакансия
Стажер в группу консультирования по вопросам косвенного налогообложения,40214,Вакансия
Интерн-аналитик в секторе розничной торговли,40214,Вакансия
Стажер в группу по оказанию услуг в области внутреннего аудита и рисков,40214,Вакансия
"Регистрируйтесь на вебинар 6 октября ""Как превратить скучное полотно текста в интересную презентацию""",40365,Мероприятие
Интерн-аналитик в секторе розничной торговли,2532,Вакансия
Интерн-аналитик в практику технологического консалтинга,2532,Вакансия
Начинающий специалист аудита,15320,Вакансия
Начинающий специалист / Стажер группы управления строительными проектами,15320,Вакансия
Лидерская программа Unilever Future Leaders Programme (направление Supply Chain),15320,Вакансия
Стажер в группу консультирования по управлению персоналом,15320,Вакансия
Стажер в группу повышения эффективности бизнеса в области розничной торговли и электронной коммерции,15320,Вакансия
Стажер направления по развитию цифровых технологий,15320,Вакансия
Product Owner образовательных продуктов,15320,Вакансия
Специалист по продажам,15320,Вакансия
Специалист по обслуживанию клиентов,15320,Вакансия
4 вакансий в отделе Project Management,15320,Вакансия
Junior HR-manager,15320,Вакансия
Консультант,15320,Вакансия
Младший аккаунт-менеджер,15320,Вакансия
